{
  "candidate": {
    "build_identity": "ILLUSTRATIVE (SQ example; not a real candidate)",
    "codex_pin": "0.158.0",
    "revision": "ILLUSTRATIVE (SQ example; not a real candidate)"
  },
  "case_definition": {
    "declared_on": "2026-10-03",
    "ref": "ILLUSTRATIVE case definition SQ-v0.2 §3",
    "sha256": "sha256:937c82cf4fe560ec7340c7b1f62ccdb9d414cc0f1d812c5d8b01ebf8ef89ecb9"
  },
  "currency": {
    "state": "current"
  },
  "date": "2026-10-03",
  "examination_opened": "2026-10-03",
  "examiner": {
    "identity": "independent candidate examiner (ILLUSTRATIVE)",
    "review_record": "EXP-RX-02 (ILLUSTRATIVE)",
    "separation": "separate_session_no_authoring"
  },
  "format": "SQ-v0.2",
  "handoff": {
    "handed_over": true,
    "not_claimed": [
      "joined_host_witness",
      "replacement",
      "public_release",
      "retirement",
      "professional_reliance",
      "practitioner_validation"
    ],
    "reported_as_independent": true,
    "supplies": [
      "scenario_outcomes",
      "evidence_limits",
      "input_gaps",
      "v3_comparison_inputs",
      "core_loop_mapping",
      "affected_rechecks"
    ],
    "to": "DEL-11-03"
  },
  "integration_owner": "App workflow-experience integration owner (ILLUSTRATIVE)",
  "record_id": "SQ-EX-05",
  "record_kind": "sq_dossier",
  "scenarios": [
    {
      "outcome": "pass",
      "run_ref": "RUN-A",
      "scenario": "V4-EXM-10",
      "steps": [
        {
          "core_loop_element": "planning",
          "counts": true,
          "outcome": "pass",
          "result_record": "EXP-J-1 (ILLUSTRATIVE)",
          "state": "recorded",
          "step": "J-1",
          "supplier_cases": [
            {
              "case_id": "NV-01",
              "deliverable": "DEL-01-03",
              "file": "NATIVE_PLANS_TOOLS_DELEGATION.md"
            },
            {
              "case_id": "NV-02",
              "deliverable": "DEL-01-03",
              "file": "NATIVE_PLANS_TOOLS_DELEGATION.md"
            },
            {
              "case_id": "WR-VC-01",
              "deliverable": "DEL-02-02",
              "file": "WORKSPACE_AND_REGISTRATION.md"
            }
          ],
          "v3_reference": "J04 (plan revised from 90 to 60 minutes)"
        },
        {
          "core_loop_element": "execution",
          "counts": true,
          "outcome": "pass",
          "result_record": "EXP-J-2 (ILLUSTRATIVE)",
          "state": "recorded",
          "step": "J-2",
          "supplier_cases": [
            {
              "case_id": "NV-03",
              "deliverable": "DEL-01-03",
              "file": "NATIVE_PLANS_TOOLS_DELEGATION.md"
            },
            {
              "case_id": "VC-NIR-01",
              "deliverable": "DEL-01-04",
              "file": "NATIVE_INTERACTION_RECEIVING.md"
            },
            {
              "case_id": "VC-NIR-10",
              "deliverable": "DEL-01-04",
              "file": "NATIVE_INTERACTION_RECEIVING.md"
            },
            {
              "case_id": "VC-R-03",
              "deliverable": "DEL-01-02",
              "file": "EXECUTION_AND_RECOVERY.md"
            }
          ],
          "v3_reference": "J02, J04 (real tool use)"
        },
        {
          "core_loop_element": "workflow saving",
          "counts": true,
          "outcome": "pass",
          "result_record": "EXP-J-3 (ILLUSTRATIVE)",
          "state": "recorded",
          "step": "J-3",
          "supplier_cases": [
            {
              "case_id": "WR-VC-02",
              "deliverable": "DEL-02-02",
              "file": "WORKSPACE_AND_REGISTRATION.md"
            },
            {
              "case_id": "WR-VC-08",
              "deliverable": "DEL-02-02",
              "file": "WORKSPACE_AND_REGISTRATION.md"
            },
            {
              "case_id": "VC-NIR-14",
              "deliverable": "DEL-01-04",
              "file": "NATIVE_INTERACTION_RECEIVING.md"
            }
          ],
          "v3_reference": "J05 (workflow created)"
        },
        {
          "core_loop_element": "workflow saving",
          "counts": true,
          "outcome": "pass",
          "result_record": "EXP-J-4 (ILLUSTRATIVE)",
          "state": "recorded",
          "step": "J-4",
          "supplier_cases": [
            {
              "case_id": "WR-VC-09",
              "deliverable": "DEL-02-02",
              "file": "WORKSPACE_AND_REGISTRATION.md"
            }
          ],
          "v3_reference": "none recorded (v3 had no draft-trial distinction)"
        },
        {
          "core_loop_element": "workflow saving",
          "counts": true,
          "outcome": "pass",
          "result_record": "EXP-J-5 (ILLUSTRATIVE)",
          "state": "recorded",
          "step": "J-5",
          "stimuli": [
            {
              "evidence": "ILLUSTRATIVE ST-2",
              "id": "ST-2",
              "produced": "native"
            }
          ],
          "supplier_cases": [
            {
              "case_id": "WR-VC-03",
              "deliverable": "DEL-02-02",
              "file": "WORKSPACE_AND_REGISTRATION.md"
            },
            {
              "case_id": "WR-VC-05",
              "deliverable": "DEL-02-02",
              "file": "WORKSPACE_AND_REGISTRATION.md"
            },
            {
              "case_id": "VC-13",
              "deliverable": "DEL-02-01",
              "file": "WORKFLOW_DECLARATION.md"
            }
          ],
          "v3_reference": "J05"
        },
        {
          "core_loop_element": "workflow saving",
          "counts": true,
          "outcome": "pass",
          "result_record": "EXP-J-6 (ILLUSTRATIVE)",
          "state": "recorded",
          "step": "J-6",
          "stimuli": [
            {
              "evidence": "ILLUSTRATIVE ST-3",
              "id": "ST-3",
              "produced": "native"
            }
          ],
          "supplier_cases": [
            {
              "case_id": "VC-AAC-08",
              "deliverable": "DEL-01-04",
              "file": "APP_ACT_CONTROL.md"
            },
            {
              "case_id": "VC-AAC-13",
              "deliverable": "DEL-01-04",
              "file": "APP_ACT_CONTROL.md"
            },
            {
              "case_id": "VC-AAC-07",
              "deliverable": "DEL-01-04",
              "file": "APP_ACT_CONTROL.md"
            },
            {
              "case_id": "VC-AAC-03",
              "deliverable": "DEL-01-04",
              "file": "APP_ACT_CONTROL.md"
            },
            {
              "case_id": "VC-NIR-16",
              "deliverable": "DEL-01-04",
              "file": "NATIVE_INTERACTION_RECEIVING.md"
            },
            {
              "case_id": "VC-37",
              "deliverable": "DEL-04-03",
              "file": "RECORD_SEMANTICS.md"
            },
            {
              "case_id": "WR-VC-12",
              "deliverable": "DEL-02-02",
              "file": "WORKSPACE_AND_REGISTRATION.md"
            },
            {
              "case_id": "WR-VC-05",
              "deliverable": "DEL-02-02",
              "file": "WORKSPACE_AND_REGISTRATION.md"
            }
          ],
          "v3_reference": "J05 (saved to the project library)"
        },
        {
          "core_loop_element": "reuse",
          "counts": true,
          "outcome": "pass",
          "result_record": "EXP-J-7 (ILLUSTRATIVE)",
          "state": "recorded",
          "step": "J-7",
          "stimuli": [
            {
              "evidence": "ILLUSTRATIVE ST-2",
              "id": "ST-2",
              "produced": "native"
            }
          ],
          "supplier_cases": [
            {
              "case_id": "WR-VC-06",
              "deliverable": "DEL-02-02",
              "file": "WORKSPACE_AND_REGISTRATION.md"
            },
            {
              "case_id": "VC-E-18",
              "deliverable": "DEL-02-03",
              "file": "EXECUTION_COMPATIBILITY.md"
            },
            {
              "case_id": "VC-40",
              "deliverable": "DEL-04-03",
              "file": "RECORD_SEMANTICS.md"
            }
          ],
          "v3_reference": "J05, J07 (selected in a fresh chat)"
        },
        {
          "core_loop_element": "workflow saving",
          "counts": true,
          "outcome": "pass",
          "result_record": "EXP-J-8 (ILLUSTRATIVE)",
          "state": "recorded",
          "step": "J-8",
          "stimuli": [
            {
              "evidence": "ILLUSTRATIVE ST-1",
              "id": "ST-1",
              "produced": "native"
            },
            {
              "evidence": "ILLUSTRATIVE ST-3",
              "id": "ST-3",
              "produced": "native"
            }
          ],
          "supplier_cases": [
            {
              "case_id": "WR-VC-01",
              "deliverable": "DEL-02-02",
              "file": "WORKSPACE_AND_REGISTRATION.md"
            },
            {
              "case_id": "WR-VC-12",
              "deliverable": "DEL-02-02",
              "file": "WORKSPACE_AND_REGISTRATION.md"
            },
            {
              "case_id": "VC-AAC-08",
              "deliverable": "DEL-01-04",
              "file": "APP_ACT_CONTROL.md"
            },
            {
              "case_id": "VC-AAC-13",
              "deliverable": "DEL-01-04",
              "file": "APP_ACT_CONTROL.md"
            },
            {
              "case_id": "WR-VC-03",
              "deliverable": "DEL-02-02",
              "file": "WORKSPACE_AND_REGISTRATION.md"
            }
          ],
          "v3_reference": "J07 (refined workflow)"
        },
        {
          "added_reason": "Run of revision 2 on new inputs: WR TT-7 (PROPOSED), not V4-EXM-10's words; recorded, not aggregated",
          "core_loop_element": "reuse",
          "counts": false,
          "outcome": "pass",
          "result_record": "EXP-J-8R (ILLUSTRATIVE)",